53,Yuan Khai Qi,Howe Lau,2,No,checked,"I am staying in Kent Ridge Hall. I am also the chairperson for Kent Ridge Enterprise whose job is to organise entrepreneurship events and sharing’s for Kent Ridge residents. Some of the events include a pitching competition called Pitch Night, and other Entrepreneurship related events.","I have interned at multiple startups since 2020 such as ExpertConnect Asia, Sealed Network and WhyQ. ExpertConnect Asia and Sealed Network are both expert network startups while WhyQ is a hawker delivery startup.

The closest experience I have to the Venture Capital space was when I was given an opportunity to be part of the organising team for a corporate accelerator programme. I wasn't part of coming up with the problem statements or masterclasses but I was in charge of the more administrative job such as marketing and outreach. One of the more enlightening task I got to do was being able to sit in on the interviews when the organising team was choosing the participants and also the final meeting where they were choosing the winners who eventually were incubated in the accelerator programme. I was also present at the pitching competition and this opened my eyes and got me more interested in the entrepreneurship space. The masterclasses were also very interesting as topics such as product market fit and problem definition was taught and discussed.",5,5,I want to join Protégé Ventures because I have interest in the Venture Capital space and I believe that I can learn a lot from Protégé Ventures and be exposed as a student to the VC space. I think that it is very interesting that Protégé Ventures have money to invest in startups that they deem valuable.,3,1,"The startup I a most likely to recommend is Friz.

The first reason is because start-up and freelancers have a very close-knit community that likes to network and help each other. This is a good platform/company that these individuals will recommend each other. There will be a high adoption rate when a service is recommended through word of mouth.

The second reason is that there are no clear competitors for companies that cater to freelancers with an added benefit of bookkeeping for freelancers. This comparative advantage and early adoption will set a good stage and starting point for Friz to grow.",2,1,"The startup I am least likely to recommend is Whizz Mobility.

The first reason is because Whizz Mobility does not have a competitive advantage over other Autonomous Delivery Robots (ADR) in Singapore.

The second reason is that there are too many players in the ADR game all over the world and the company that can make use of the economies of scale the earliest will have the biggest market share in the ADR market.",3,3,"I am confident with Outreach because of my previous internships where I had to talk to many corporate experts and see whether they are suitable for what the clients need.

I am also confident with Programs and Operations because I am involved in Kent Ridge Enterprise who plan pitching events in the past.",A: Good fit for deal sourcing side where we need to reach out to founders,A: Relevant and clearly demonstrated experience,I think the most important question VCs should ask is who are your paying customers? This is because I think sometimes some people are unclear who their customers are. A common mix-up in the pre-seed/ideation phase that I learned from a mentor is that some people place more importance to end-user instead of paying customers. ,"B: it is true, but I think its too generic",B: not compelling,"The first individual that I identify is an unstoppable force of nature is my uncle. Despite being in his sixties, he remains driven and continually strives to expand his knowledge. He is currently a politician and Hong Kong and has attained at least 5 bachelors degrees in various fields. He is a man that never settles for comfort but instead constantly embraces new learning opportunities. It is this drive and rigour that has inspired me since I was young.

The second individual is my close friend who is currently in university under a full scholarship in SMU. He comes from a single parent family which has resulted in some financial strain. His financial situation has forced him to be extremely resilient and hardworking since young as he knew that he did not have the comfort of being able to rely on his parents for any financial support. His optimism and can do attitude in the face of adversity makes him an unstoppable force of nature.

The third individual is an acquaintance I met in hall who has dedicated her life in servitude of others. She is currently taking Social Work in NUS and is also the chairperson of her hall’s Volunteering Committee. Her dedication and passion to help those in need is commendable and she inspires me tremendously with her enthusiasm for volunteering. Her passion and love for what she does makes her an unstoppable force of nature and is an inspiration to others to not only follow their dreams but also to help the underprivileged in society.",5,4,I think that the probability of me travelling into space is slim. This is because I don’t think I will dare to even leave Earth. There is something about leaving this planet and travelling towards the vast outer space which deeply unsettles me.,3,2,"Average candidate with limited analytical still, but can see effort in non-analytical questions",Clearly has interest/experience in the startup space - but analysis seems lacking across the questions
54,Yuan Khai Qi,Howe Lau,3,No,checked,"Internship with PwC Deals, Varsity training at school (Cheer)",NIL,0,0,"I have had a deep interest in Venture Capital and early-stage funding ever since watching Shark Tank and seeing the impact the right investment at the right time can have to the wild dreams of entrepreneurs. I love working with businesses and understanding what their ambitions are, providing the means to achieve their ends and most importantly going the distance with them.
By joining your team, I get to work with like-minded individuals who share this passion with me, and I absolutely love working in a highly-capable and energetic team like yours. At the end of the day, I hope for this relationship to be mutually beneficial, where we both learn from each other and are able to enrich each other in some way, shape or form.",5,5,"Polybee.

Vertical & Indoor Farming is essential for a space-constrained country like Singapore, and with how the government is looking to increase the country's self-sufficiency, I believe that this technology is essential for the indoor farming space and investing in this company would build towards that goal.

There are foreseeable growth opportunities for this company also, with the data that is generated from their pilots and projects with customers being able to be repurposed for other business opportunities. Much like how Tesla is a data company that uses cars to collect road for better autonomous driving, Polybee could be that data company but for autonomous drone piloting (repurposed to other than cross-pollination).",4,4,"Either Noah or Ease. These two are similar in their business idea, but catered to a specific gender.

The teleconsultation business has numerous competitors (Doctor Anywhere comes to mind) all fighting for an already competitive piece of the pie, and on top of that they are seeking to disrupt the offline medical consulting space. I believe that it would be unwise to bet on a winner in this space, and although both these businesses have their USP (catering specifically for men or women), I don't see sustainable growth in the future for these businesses based simply on the idea.

On top of that, I believe that sooner or later having a brick-and-mortar store is necessary for credibility's sake in the medical consulting profession, something which these two businesses don't have as an perk for now. ",4,4,"Financial Modelling, Credit Analysis","C: skillset might not be fully relevant in PV, but still appreciate his/her effort in stating them down",C: Not particularly relevant,"Can you articulate your idea in 90 seconds or less, and why are you the right person to work on this idea?

These two questions coming together build you a holistic picture of whether the founders understand their business enough to articulate and action it properly, and why they have that edge that is necessary in a sea of start-ups and expanding businesses.

On a side note, drilling the founders on the financials (landed costs, margins, quarterly sales and forecasts) is also equally important, as an idea stays an idea until there's sustainable cashflow to turn it into a business.","A: Good choice of questions. Even though the cashflow might not be that applicable in our context yet, it is still important to identify these two factors","B: don't think the ""90 seconds"" elevator pitch is really a relevant question by the VC - if anything it should have been initiated by the startup","Derek Chong, Masterchef Asia 2021. We were friends in hall at NTU (Hall 12), and I've always known of Derek's passion for food even in those days. He would bring his chef equipment (an ice cream machine, to hall!) and actually offer to cook in Hall (Twelve Flavours) and started a mini business that way. His food was undeniably delicious, and the man had a passion for food that was simply unstoppable. His talents speak for themselves, with him winning the recent Masterchef Asia.

My previous intern manager, Jane Lim. I was under her during my stint at Citi, and I really enjoyed the energy she had for the desk at the time. She was one of the youngest senior vice presidents of IPB Citi and working with her always a sprint, but a thoroughly enjoyable and very enriching sprint it was.

Ray Sheng, my hallmate from hall at NTU also. Ray Sheng is one of the most passionate entrepreneurs I know, running multiple F&B businesses in NTU and has even been featured in the news for how much he gave back to the community during the pandemic. He dared to take that step that few have been willing to try, and his passion and growth has always seemed unstoppable to me also. ",4,4,"Probable but not a 100%.

With the recent interest in retail space travel and ramp up in growth of space-travelling businesses Virgin Galactic and Blue Origin, I believe the technology for retail space travel will exist in my lifetime.

The only question is, will I be lucky enough to be awarded that opportunity, and if I do, will I be able to afford it? I will certainly work hard towards that goal in the mean time, but the future is never certain.",3,2,"Pretty good individual even though he/she does not have prior VC/ startup experience
","Clear effort and interest shown, and analysis was p solid"
56,Yuan Khai Qi,Howe Lau,4,Yes,checked,None.,I have interned at a startup which worked for the distribution of clothing accessories.,4,4,"I would love to be exposed to the VC space. I want to learn how valuation decisions are made, the negotiations take place, the evaluation is done and finally how VCs aid startups in becoming a success (and also learn from the failures that one might encounter in this space).",3,2,"I would recommend Ease Healthcare. The reasons are as follows:
1. Sexual health awareness is on the rise and already at an all time high. Thus, the demand is clearly present and there are a great number of markets that can be explored by the startup.
2. STIs, sadly, are also increasing in this day and age. Providing a doorstep solution for this need has great potential and is a space that can also be expanded to other such medical fields.
3. Healthcare is a growing and competitive industry. This means that the scope of getting connected to best-price-great-quality partners and vendors is a good possibility and we can always have a plethora of options for improving our product/service.",3,3,"The startup I would least recommend is Whizz.

1. I feel that the concept is brilliant but logistically, it might be difficult to incorporate. The physical appearance itself makes it hard to cross stairs and constricted spaces, putting it at a disadvantage to it's alternative- human delivery.
2. For a safe delivery experience, the robot would have to move at a conservative pace, meaning there can be a fall in delivery time, adding complications to the speedy and efficient delivery networks that companies and potential clients want.
3. Moving away from the physical product, I feel that the capital investment for any company to use Whizz robots will be high and this might drive away smaller companies looking for logistics solutions, thereby reducing out potential market.",4,4,I am confident in Programs and Operations.,"B: not explained, but could possibly help operation team with some works
",C: No elaboration given,"""What do you think are the flaws in your business and what are you doing to alleviate them?""

I feel this question would create a self awareness in the startup founder/representative. Also, a satisfactory answer would ensure that the founder is willing to accept the faults of his business and is proactively working towards making it better. ","B: I kind of like his/ her straightforwardness, but still think that there are more important questions to ask instead of this",B: not compelling,"3 individuals in my network that I would identify as unstoppable forces of nature would be Vinay Ananthanarayanan, Ruchi Damani and Charles Robertson.

Vinay is a director at Aon (I work there at the moment) and I consider him to be a force of nature because my conversations with him have shown me the importance of understanding before implementing and how important it is to connect with your audience, be it an intern or a client.

Ruchi works in HR at an MNC and is my aunt. She has shown me that with hard work and humility, anything is within your grasp.

Charles is also a director at Aon and my manager there. He has shown me the importance of knowledge and experience. Sharing it in the most selfless way with me, I have learnt that any problem is solvable with the correct type of mentorship and guidance.",4,3,"I think it's almost a certainty that it would be achievable in my lifetime.

I am very confident in my answer because we have private as well as public entities working towards it as I type my answer. Technology and calculative abilities have come so far that it gives these entities the tools to already conduct test flights and simulations, studying and working more towards normal human travel to space. I am sure once public, commercial travel to space begins (in a decade or so), I will be able to travel as well.",4,2,Average individual with limited analysis,"Effort shown, but analysis is p meh, and smoky at times"
57,Yuan Khai Qi,Howe Lau,3,No,checked,Soccer Coaching & Tuition,"I’ve even a part of a start up company in the sports sector, managing marketing, HR, PR, and accounts of the company as well as the direction that the company wants to head towards. Furthermore my analysis on key decisions that need to be made have a large weight age on my professional opinion ",5,4,I am very keen to learn more about the field as I have considered it as a career path to help these startups expand and grow. As an individual I love hands on experiences and being able to see things happen in real life rather than just through a textbook. ,3,1,"Whizz Mobility. Looking through all the options, this is the one that has seemed most unique and world-friendly. In the sense that it is something that can be developed and brought to any country. Everywhere needs something delivered of some sort. From food, to parcels and packages, there’s always a use for it wherever you are. Furthermore the market competition for thjs is small with only one or two who have one foot in the market, and undergoing development, there is truly a gap in the market for automated deliveries. ",2,1,"Friz. It seems to lack a USP in comparison to other platforms that are already available on the market. We have platforms like Transferwise and FlyWire that can do the same as Friz.
In addition, even though it promotes their credit-line as not based on the individuals salaries, it still goes through a level of discrimination based on the fact that “worthiness” still needs to be there. When in this generation the point is that a chance needs to be made not just for those who have the right education and background but chances for those who lack it but seem to have the ability to reach above and beyond. Aptitude tests, general knowledge tests and get-to-know tests are all a viable way to see an individuals way of ring worthy of a credit line/loan for starting up. ",2,1,"Social Media Marketing - I’m a creative makeup artist who creates content on my Instagram for the world to see. As a passion this led me to self learn how to effectively use social media preforms like Instagram to grow my following for opportunities (www.instagram.com/lixuanhou).
Website Building - as a manager of a soccer academy, while my work time and goals are based on my own time, own target, it be taken great responsibility in rebuilding our website from scratch without prior knowledge (https://www.sg7-soccer-academic.com/).
",A: Great fit for Mar Comm as she is experienced in social media marketing and website development,"A: Seems like a great fit, with portfolio provided","What is your vision for the company and with zero limitations, where would you see your company?
I believe that this question really shows the amount of commitment and passion an individual would have for their start up. It allows for VCs to see if the startup is looking at developing new innovations and keeping up with the market in the long term, or is the startups vision solely based on what’s currently in trend. This question would help VCs in eliminating those companies that are in the business for the short term and seek no further development. ","A: Good because it shows how well the startup team is aware of the surrounding, and can indirectly tell if the team has a long term plan","A: big picture question, insightful take","1. My mother - though given a family business in real estate, she chose to not make use of it, but instead fulfil her own passion in consultancy and investment.
2. My boss - after having his plans to migrate to pursue his master degree was cancelled due to Covid-19, he decided to follow his passion and open his own football academy from scratch. Though having many downfalls, we worked through it and persisted to keep the academy running. Proudly I can say the academy is doing very well.

As for the other one, I’m still searching for individuals to fill up that slot. ",3,2,"Realistically speaking, not so high. Given the chance, I’d probably jump and take the opportunity if it checks out and I was able to afford it. But looking at the level of testing and potential delays (such as covid, or lack of research) the potential for me to be able to travel into space is unrealistic.
I’m quite confident of my answer - it uses common sense and general knowledge. Space is not yet a vacation spot for normal humans who are not experts in the field, and even if it were, getting up into space is costly and time consuming in which I could be persuing something else. ",4,2,"Solid candidate for Mark Comm, but might have limited investment-related skill","Analytical answers were probably the weakest among the 4. However, possibility of synergy with marketing? Questionable - not sure if particularly relevant"
