20,Clarence Ong,Nathaniel Ling,3,No,checked,I run a coaching academy.,NIL,1,1,"I feel working within VC is much more meaningful as opposed to investment banking for example. To me and maybe to some others, sometimes it feels like the world has progressed so much and everything worth doing has been done but I feel that there are still a lot of “secrets” to uncover, a lot of improvements to be made in society so there are still many great companies to be built or at their start-up stage. We could cure cancer, dementia or even invent faster ways to travel. And so, I think the job of VCs are really important and meaningful and I want to be part of it, working w ambitious and passionate people to find and back the start-ups. And personally, coaching most of my students from scratch and many have been with me since I started, I have learnt to empathise better. I have forged really close relationships w my students and parents and find myself to really enjoy seeing the progress of my students, so much that I am willing to coach over 20 hours a week while in uni, which seriously pushed me out of my comfort zone.

I want to join Protege Ventures to learn more about the science and art of a venture capitalist; How VC funds are structured, how they operate, and why organisational structure matters. Understand the basics of deal flow, how a VC funnel works, the different stages of financing, what and how to develop an investment thesis, and how to source deals in nascent industries. Joining Protege Ventures would allow me to have a practical experience in gaining in-depth understanding of the various metrics that are used to evaluate startups and their performance by early-stage investors.

Working w passionate and hardworking people really brings out the better in me, it makes me want to give more and do better. As odd as it sounds, I feel coaching is similar to venture capital in the sense that you get to empower others and provide meaningful impact to others. It makes me more “human”.",3,"3
","I would recommend Friz.

The Covid-19 pandemic has accelerated the growth of the gig economy as remote work became the new norm and I think the gig economy is here to stay. With government-mandated lockdowns in place, many people turned to freelance jobs for extra cash or work.  Businesses are also seeking to hire more freelance talent to complete projects. We can see this trend in Fiverr and Upwork's growth during the pandemic and this trend would bode well for Friz that are serving this niche for the coming years.

The market for digital payments are competitive, we see companies like Square offering their cash up and targeting the unbanked, yet at the same time, traditional banks are coming into the picture. What I like about Fizz is that it is not trying to compete in this entire market, instead it is serving a small niche of a particular group in one place. Avoiding competition this way is a wise move. The reason is simple: it is easier to dominate a small market than a large. What's great about Fizz's targeting strategy is that their customers are all based in Singapore, concentrated together and served by few or no competitors. After doing my due diligence, I can't seem to find any other digital payment services in Singapore that are targeting this niche.

I think Friz will build a sticky ecosystem over time. I would expect once their customers use their platform, they will continue to do so as they manage their personal brand and finances around the entire system, which will increase the switching cost. Given their ever-increasing gig economy and their ecosystem, I would believe their rate of customer acquisition to exceed their churn rate. If that is true, Friz is primed for extremely rapid growth as long as they focus their efforts on improving those two metrics above.",3,"4
","I would not recommend Whizz.

This is how Whizz markets its food delivery robot:
1. Rain or shine, mud or pavement, our robot can handle it while you’re comfortably indoors.
2. The resulting boost in productivity means we can execute deliveries at a low cost.
3. We provide a one-stop robotics solution for your business—we handle the fleet and logistics so you don’t have to.

This is definitely exciting and I do see the value in it. In terms of achieving product market fit, I think they are still far away from it. It can't run on stairs, which I think it is something to consider. From the video, it looks slow and I am skeptical in regards to how long it takes for the food to arrive. It is also bulky and I am not sure how it is able to navigate its way through certain residential areas.

What do customers value most? I think this product cuts out the middlemen - delivery guy, which will allow it to price at a lower cost. So that would solve just one of the customers' problems. But most customers would want it fast. At this point, it is too risky to invest in this them as I think distributing food with a robot is fundamentally flawed.

This does not mean it is a failure. Friz is still in its really early stage and I expect many pivots, experiments and validated learning to be made.

",4,4,"Human Resource Management, Marketing, Video-editing.",B- What does HR mgmt even mean for us?... but Marketing and video-editing is good to haves.,B - General skillset,"I don't think there is a right or wrong answer to this. But personally, i feel a VC needs to ask whether the startup knows which one engine of growth that it is focused on and whether the right kind of metrics are used. What I learnt from the ""Lean Startup"" by Eric Ries, there are 3 main engine of growth; sticky, viral and paid. At any time, a company could invest its energy in finding new customers, improving overall quality or driving down costs, and the list goes on. If a start up does not even know their engine of growth, it would not know which give the metrics to prioritise, this usually leads to a substantial amount of time and resources being wasted.

For example, let's say the core product of a startup exhibits viral growth, the key to achieving sustainable growth for a startup is to first know their engine of growth. Knowing it allows the startup to know which actionable metric it should focus on to measure its growth. For.the viral engine, it can be quantified by the viral coefficient which measures how many new customers will use a product as a consequence of each new customers who signs up. A viral loop with a coefficient that is greater than one will grow exponentially. So companies that rely on the viral engine of growth must focus on increasing the viral coefficient more than anything else, because tiny changes in this number can cause dramatic changes in their future prospects.

Since each engine of growth can be defined quantitatively, each has a unique set of metrics that can be used to evaluate whether a startup is on the verge of achieving product/market fit. A startup with a viral coefficient of 0.9 is close to success.",A - Could tell the applicant thought through the answer. Made effort to explain and elaborate. Abit fluff but yeah. ,"B - Good elaboration, but I think more specific questions could be mentioned here (like this individual mentioned about metrics. Are we looking at the churn, retention, GMV growth ,etc??) I'm not too sure here","Both of them are close friends of mine.

Keane Kwa. Passionate, entrepreneurial, and meticulous, he has a good business acumen and a broad grasp of technology. He is particularly dangerous in areas like machine learning and coding. He is a Software Engineer @ Nano while schooling as a Renaissance Engineering Scholar @ NTU. He is skilled in React/Redux, REST API integration, Python, JavaScript, HTML, CSS and Excel VBA. Certified in Amazon Web Services (AWS).

Steven Sebastian. He has deep competence in finance. He understands the latest market dynamics really well and knows how to build financial models.",3,3,"I would rate it a 50-75% chance perhaps 10-15 years from now. I am a definite optimist and so I do believe the future will be better than the present as long as people continue to plan and work towards the creation of new things to better the world.

For over a decade, the world has awaited the launch of commercial space tourism operations that actually fly folks into space. Just two weeks ago, Sir Richard Branson's Virgin Galactic space plane has recently conducted the first of three key test flights that should enable it to enter commercial service. The recent successful test flight was a major step toward the future of the company. Basically, it goes to shows that commercial space flights is possible in the near-future. The world's richest billionaires are now racing towards commercialising space flights. And just as I am writing this, news are reporting that Amazon founder Jeff Bezos will take the first Blue Origin flight into space. Over the next twelve months, I am confident that the science-fiction concept of space travel will turn into a reality. And by mid-2022, Virgin Galactic and Blue Origin should be regularly flying people into space every month.

I do not rate it a 100% as space flights are for the rich, tickets are priced at staggering amounts of at least $200,000 USD and I can't afford it now. If space companies like Virgin galactic has the potential to scale and successfully launch flights, price parity in the future could be achieved for the mainstream to experience space flights too.",3,4,Pretty typical application. Could tell he put in effort with his answers and did not just autopilot it. ,"I'm not sure actually. Although I gave higher scores in general for this applicant, I'm not really a fan of this application as a whole. I felt that most answers were droning on in one full circle without addressing much, but it was pretty elaborate that it was hard not to give a low score..

If you look at applicant 23, you will see such a huge difference between the two"
21,Tan Jie Hui,Tee Zhi Zhang,2,No,checked,Teaching assistant or part time internship (TBC),"I've interned at one startup and currently doing an internship in another startup right now. The former internship was a web development one for Pitchspot @NUS Hangar where I was not only involved in creating features for our product, but also making some business decisions as well as designs for user interfaces. For my current internship, I'm a machine learning analysts optimising our methods to diagnose and forecast retinal diseases. ","5
",5,"I would like to embrace this opportunity to understand the VC space and mindset better as I have plans on creating a startup too some time in the future. My internship and hackathon experience have taught me how important it is to develop features and content that have validation or to test for validation, not just create something ""cool"". Not to mention, innovation can come in the form of the business model (e.g. Github VS BitBucket). I'm also fascinated by how companies such as SGInnovate identify and invest in lots of amazing startups. Therefore, I believe by joining Protege Ventures, I can deepen my understanding of what makes a ""deep potential"" startup and hopefully create one myself. I also want to widen my network of like-minded people which I feel I'll find many in Protege.",5,5,"I personally feel Friz is the strongest recommendation. First off, it's backed by Y Combinator with a 6 figure investment so there must be some level of credibility. Secondly, after looking through the ""Why"" which describes the pain point and demographic they're targeting, it has the greatest potential and ease to scale compared to the others. The pain point seems valid as a full on invidividual freelancer would think similar existing products are overkill (like Talenox for companies). In terms of target audience, I think there's a growing number of freelancers world wide due to a gradual shift away from 9-5 jobs. It's a completely digital service that can allow them to scale fast without much extra capital compared to robots-based startups which have more uncertainties. Lastly, the profile of the founders of Friz (PPRO/DBS ex-software engineer and ex-mastercard product manager/analyst) suggest that they have the ability to lead this startup both on technical and business development fronts. As one invests in the startup, one also invests in the founders. Therefore, I would be willing to invest in them because among the profiles and value propositions of the 5 in the list, I'm quite confident they can pivot and adapt to various scenarios.",4,4,"Least likely to recommend for me is Whizz. One of the reasons is it's a robot-based company which has lesser chance of scaling that other deep tech startups that are for instance machine learning based. Secondly, the business model isn't very clear, so if I had to guess, the cost to ""handle the fleet and logistics so you don’t have to"" is quite high. Furthermore, the entire Obike, Ofo and Mobike bicycle sharing fiasco has made me semi believe that abuse is imminent given that this is a consumer-facing product. There's a possibility for it to work in other countries like Japan though. I believe they have potential but not as much as the rest based on my research, for instance the ease-healthcare has a growing brand awareness as evident from its instagram following of 12.2k. I think last but not least, extra detail on the technical feasibility may be required because autonomous vehicles are still very much in its infancy (even Tesla is struggling with this).","4
",4,"I am largely a techie who has experience in Software Engineering (web development), Cyber Sec, Machine learning and robotics. I am also improving my design skillset through 2D and 3D graphics, as well as Figma designs which I use extensively in hackathons and my previous internship.

Current portfolio: https://hjunleon1999.github.io/ScholarshipApplcation/
Art Account: https://www.instagram.com/codertriesart/?hl=en

",A,A: very proficient in digital design and programming skills that could benefit PV with special projects,"I believe the most important is if there's any sort of market validation and current traction regarding that startup's venture that requires investment. Usually startups try to paint a rosy picture of themselves. Asking this question would reflect how confident they and the target audience are in the value proposition and business model, which are very crucial factors when considering whether a company can scale with the investment and make your investment worth the while. This is especially important for social-media based startups (like clubhouse) that can 50x and more after the first few investments, but could also entirely flop even with proper research. Asking this question could also highlight some key thought processes and decision styles of the pitchers (usually the founders) to show if they can push it further.","A
","A-: demonstrates a good understanding of investments, could be a bit more detailed and targeted for VC-type investments","My previous internship CEO, Ryan is one of them. He's very on the ball with everything and despite Pitchspot being 4 years old, they've pivoted 7 times and the startup spirit is still strong in him. Every task is pushed to completion. Another individual would be Daryl from Augmentus. His passion for business development makes him pretty much unstoppable, especially since he has build a couple of them already. In my opinion, he's a major pillar in Augmentus and arguably one of the more influential figures of student entrepreneurship and robotic automation in Singapore. Last but not least, would be Yong Kang. His interest in the startup scene and tech has been around for 4+ years and it hasn't wavered ever, only ever growing. From juggling school projects to his software engineering internship and current startup venture ""MatchedIn"", I don't think I'll ever see him stopping what he does best.",5,5,"About 30%. I'm not exactly confident but not shutting off this possibility at all. As a personal choice, I would not risk my life for an expedition in space when I've still have the whole world to explore (which I doubt I can explore half of it in my life time). However, if it's safe enough like flying and aeroplane, would definitely give it a go, though with that said I predict it would be 2050 before this is a reality.",3,4,,a very motivated candidate who has a keen interest in startups/VC. demonstrates understanding into this space and possesses good analytical skills. skillsets will also benefit PV
22,Tan Jie Hui,Tee Zhi Zhang,3,No,checked,Summer 2022 applications.,currently interning with a VC,4,5,The strong alumni network and unique opportunities appeal to me. I want to gain deeper exposure to dealflow and understanding the inner workings of a fund.,2,2,I will invest in Ease. I think it has a unique value proposition by eliminating the mental stereotypes women might feel when they purchase birth control or other sexual health medication. This unique ability to achieve convenience while overcoming a traditional mental boundary puts Ease at an advantage relative to other players in the area. ,2,2,"Whizz Mobility. I think the problem that they are solving is already easily fulfilled by actual human beings and this does not really disrupt the industry. Also, the return on investment for the company looks quite poor, as I imagine that the robots/devices require substantial investment or capex but delivery fees do not command that much revenue. ",2,1,Financial due diligence. ,"B
",B- : relevant but vague,What is your 5-year plan and how are you going to achieve it?,C,C: generic without substantiation,Nicholas Koh and Cavan Chew. These are individuals who have defied the ordinary tracks in life and achieved beyond expectations. ,1,1,,0,0,lacking effort,"did not demonstrate keen interest in joining, obvious lack of effort compared to other applicants.
"
23,Tan Jie Hui,Tee Zhi Zhang,4,No,checked,"Table Tennis, personal software development projects","Developed mobile app prototype for NUS megic: https://medicine.nus.edu.sg/megic/index.html, team won the competition. App was meant to help bring spaced repetition to students to help them learn what they don't know better.

Tried to pivot to secondary school science tuition market, but stopped fast due to a lack of expertise, lack of commitment, and time.",4,3,I want to brush up on my analytical skill of start-ups and network with people who are working on starting companies and trying to solve problems. I think the ecosystem of entrepreneurs in Singapore is really interesting.,2,3,"Whizz Mobility. Protege ventures aims to bring student entrepreneurs from early to pre-seed funding.

1) Whizz is founded by 7 students and utilises university research ecosystem by tapping on NTU skills. They make their own robots (https://www.todayonline.com/singapore/meet-foodbot-four-wheeler-robot-delivers-food-its-belly-yours), and were trying to solve a problem that they faced themselves and knew Singapore would face (shortage of manpower). It is hard to know how strong their bond is, though, as 7 is a large number of co-founders and rifts are harder to resolve. This is a risk that is hard to evaluate through their online channel. More meetings with them might reveal how effective and adaptable they are as a team.

They are also doing part time hiring through a google form instead of a proper on boarding channel/portal, suggesting that they are in the early stage of venture building and therefore the support from Protégé will be more greatly felt. (https://www.whizz.sg/careers)
(https://docs.google.com/forms/d/e/1FAIpQLSfGd6_10xBwXjcmfEjQZ8CQH4OlXlAyw35ygCuiIQPv8zQeqQ/viewform)

2) They provide a solution that fits into the economic life of students.

Students do not have much excess income to spend on discretionary spending, so food spending will definitely be central to their economic life.

Furthermore, despite 16-24 year olds having a much lower earning power as compared to 25-34 year olds, they are a close second in terms of their food delivery usage frequency. (https://www.statista.com/statistics/1147958/singapore-ordering-food-from-food-delivery-apps-frequency-by-age-group/).

Hence, Whizz's business tries to offer a solution to students who want to get meals conveniently (rain or shine) and at lower cost (semi-autonomous and productivity due to the use of robot technology).",2,3,"polybee.

1) It does not fit into Protégé Venture's investment goals. They are not that early stage and already have the support of Temasek, suggesting that they do not need the mentorship and funds from Protege Ventures.

Furthermore, they are hiring through the SGInnovate program, which suggests that it has a more well established and funded HR. It is hard to limit the hiring primarily to students, implying that their hired expertise and past experiences might not be more student/university centric, but a mix of industry and university. They might not be able to plug into the university research ecosystem as well, even though they were spun off from NUS.

2) The solution they are working on it not central to the economic life of students. They work on agriculture solutions.",2,2,"Software development. Go to iOS App Store/Android Play Store and search for Halcyon Wash. That app was made by me.

Website development: rememberingharold.org, chuayunda.com

Side tech projects: https://chuayunda.com/category/side-projects/",A,A-: rather proficient App Making skills which are not really relevant to PV? quite proficient in web dev,"Share about what have you learned from your previous failures trying to start companies. Most companies don't make it, reveals whether the values and objectives of the VC aligns with mine, and opens for more conversation to learn about how adaptable the VC is in the face of setbacks which will most likely happen.",A,A: demonstrates deep insight into VC-startup relationship,"High school friend doing medicine and wants to work on MedTech innovation: He's working on 8 side projects, and tanked a pitch deck in 4 hours and won a pitch competition for $10,000. He's also juggling medical school well.

The psychology Professor that I worked for last summer. He juggles having a young child, teaching classes, running a full fledged research lab within Yale-NUS and outside Yale-NUS, finds time to mentor, works on projects beyond strictly academia, and is the head of studies for psychology.

My mom: she is an immigrant from Indonesia, taught herself software development and developed her own accounting software using FoxPro (in the days before programming was commonplace) without going to university, started her own business while raising 3 kids, and has had to pivot her business constantly.",3,5,"Low probability.

Cautiously confident, with caveats.

1) They figure out how to make the fuel drastically more carbon neutral https://www.bloomberg.com/news/articles/2020-01-28/can-we-get-to-space-without-huge-carbon-emissions. In which case, space tourism might actually become a thing. But I think it's a pipe dream given what we know about liquid rocket propellents, for now.

2)
Quick wiki says: ""As of April 18, 2021, a total of 569 people from 41 countries have gone into space according to the FAI criterion (579 people have qualified when including the US Department of Defense classification)."" https://en.wikipedia.org/wiki/List_of_space_travelers_by_name

if I'm very optimistic and I assume that the industry will see an exponential growth indefinitely, in the future, such that it will take half the amount of time (~ 60 years from 1960-2021) to get the same number of people (579) to space...

Plotting this graph: f(x) = \sum^{x}_{i=1}( (\frac{1}{2})^i \times 60)

It starts to asymptote at about 60 years from now, with close to infinite growth of new travellers to space. So if I live for at least another 60 years, in the most optimistic scenario,, perhaps I might be one of them. Except that I'll probably be too weak to fly to space by then... So I'll still say it's low probability for it to happen, in the next 59 years. (which takes about 7 compounding periods = 579x7/7,674,000,000, where population stays constant), which is a less than 0.01% chance.

3) I'm not one to go on trips that are excessively expensive and damaging to the earth. I'm against the idea of trips to nowhere. So I won't go to space for leisure. I'm also not in a space related industry, so I probably won't end up in space.",5,5,,"very insightful individual who can break down a problem and analyze is carefully. does not seem to have much knowledge/understanding of the VC space though, answered investments-related questions mostly referring to PV's mandate"
