36,Rahul Paleja,Darius Cheong,3,No,checked,Internship,No,0,"1
",Learn more about venture capitals and investing,2,2,"Polybee and Friz, Friz has already got seed funding from 500 Durians, Y-combinator and iterative, this indicates that other investors are interested in the company and believes there potential. Polybee is of some scale and managed to get some back up from SG-innovate, among all the start-ups listed, it seems to be among the ones that is easier to get funding from government due to nature of the work scope.
Other than reputable back ups, Friz is working on financial management which is more relatable to our daily life, indicating a better potential of expansion. Whereas Polybee is working on indoor farming, which is a field love by our government.",4,4,"Noah, it targets problems that are uncomfortable to bring up in public but doing diagnosis and payment online does not feel very secure for these kind of problems. Even if it work due to the nature of these problems, you won't expect user to user recommendation, thus losing out on potential expansion.
Whizz Mobility, it is a good idea to have robot to deliver the food around, however the current robot seems to be only able to deliver within NTU, heard that they are expanding into NUS, skeptical about how it will work when road conditions become more complex and how it will deal with stealing of other's delivery item.",4,3,"Software engineering, incoming back end intern at Bytedance",A: SWE must be good to get into a top startup,A; Technical expertise + startup experience,"What makes your products different from others? If there is another similar product in the market now, what are you planning to deal with that? I believe that start-up founders should be aware of the difference that make their products standout.","B: two generic questions, won't provide great insights for the VC",B; okay but not very compelling,"Jayden tan, Lionell lol, Claudia Koh, top internship and jobs",2,2,"10 percent. Very confident, unless I get super rich or space travel becomes affordable, it will be a one-time travel expense that I will not spend. As I cannot get anything in return other than the experience of going to space. Thus I do not think it is worth the money",3,4,"Seems like they have good qualifications, but they didn't put much thought behind the application",
37,Rahul Paleja,Darius Cheong,3,No,checked,Software Engineer at NTUitive,yes! pls look at my cv,2,3,I would like to get insight into the VC industry,1,2,"Whizz mobility. With autonomous paving the way, battery capacity increasing and COVID-19, it is very well positioned as an autonomous service provider in SEA. With a huge TAM, it has a great opportunity to be acquired by food delivery providers instead of them creating their own tech. A great 10x exit in < 5 years.",4,3,"As an investor, i only invest if i know sufficient about that industry and space. Looking at the other startups, although potentially promising, i won’t recommend anything. ",2,1,"Tech consulting, Startup founder, software engineering",A: Seems like a solid technical background,A; technical expertise + startup founder,"Essentially 90% of the startups fail in their first 3 years. As a VC, i believe it is more important to invest in the right people that finding the right company to invest in. Business models, product-market fit can all be pivoted. But people cannot, a strong culture would bring a company far.","B: Nice answer, but didn't really answer the question at the same time
","A; I like this because I think it shows a slightly deeper level of understanding, thinking about which factors are more important than others and why","I think there are many people who fit this criteria. But one person i know is Roderick Chia, the CTO of Oyika, an electric motorcycle startup. The vast amount of technical knowledge just wows me",4,3,"100% , do what excites.",2,2,"Seems like an interesting candidate, would be worth checking out",
38,Rahul Paleja,Darius Cheong,4,Yes,checked,Freelance Advisory work,"I was in Enactus and MIE. Interned with Shopback, previous Seedly Student Ambassador",5,4,"I have been extremely passionate about startups this a crucial role to learn, build a network, and leverage it to build my ground within the Startup Phase. I also feel that I can value add to Protege Ventures with my mix of experience in Sales, SEO and Accounting.",3,4,"Noah. Noah belongs in the Telehealth sector, with a unique niche on male health problems. While I would prefer to have interaction with the management team to understand the level of execution and business plan moving forward, I noticed that they have an advisor, Dr Peter Lim onboard. The Telehealth industry is expected to grow from $26.4 Billion in 2020 to $70.19 Billion by 2026, at a CAGR of 17.7%, with potential expansion to other verticals (Like medical concierge, which they are implementing already) The business model is easily scaled globally, with likely high profit margins. ",3,3,"Whizz Mobility. While a MVP has already been created, (1) I cannot see a profitable way to generate revenue - if they are executing a B2C model, this delivery system does not provide a distinct benefit to the consumers, while competing against other more established and recognized food delivery companies - Grabfood, Foodpanda. If they are attempting to provide such services to food delivery companies, they have a limited client base and marginal benefits. (2) There are also limitations currently with their MVP, such as stairs and security. preventing them from scaling within Singapore, much less globally. ",3,3,"Business Development with AIA, SEO with Shopback, Accounting Degree.","B: none really relevant 
",B; Applicant isn't really mentioning skills here except maybe SEO. Experience working in startup might be good,"Questions on the business model: size, opportunity, competitors, traction
Questions on the management team: roles, execution.

These questions are crucial in determining the sustanbility and execution within Startups.","C: no reasoning, very vague","B; not very compelling, could have did a 1 min google","Seedly Co-Founders, determined, yet strong people individuals. My Father, a car repair shop owner, showing me the importance of grit and discipline in success. Rachel Yong, founder of Gulliver, Product Manager for Google - she is a role model and an example of how a peer should be. ",4,4,"0%. Very confident. Whatever a person can set their mind to, they can achieve. In my current roadmap, I do not have the intentions to travel into space. ",3,4,Ok-ok ,
39,Rahul Paleja,Darius Cheong,2,No,checked,hall commitments,"worked for a startup in 2015 similar to honestbee, helped them to trial their mobile app during the pilot stage to identify bugs or glitches on their platform",4,4,i would like to learn more as to the different stages of a startup and also the funding process as well. I would also like to understand what the thought process and decision making framework that a VC has.,3,4,"1) Polybee. Indoor farming and agriculture has been on the rise not only in singapore but also worldwide, the bee population is declining as well. Therefore there is a need for a successful solution to complement organic pollination. Also, having an autonomous solution means that there is lesser reliance on human labour and as such it can be easily scaled and replicated in different farms, making it an attractive investment. 2) Noah. Most men have a huge ego and they would not be willing to purchase such drugs/treatment over the counter, having a discreet all-in-one stop solution would allow them to consider using such treatment, as they would not have to fear getting discovered. Also, their seamless process makes it convenient and accessible to their customers, increasing customer satisfaction levels and allowing them to be more inclined to come back for recurring treatment.",4,3,"ease healthcare. it is too basic and the treatment that they offer is not attractive as there are many similar products in the market. I would think that the products sold would be one time purchases and customers would not be likely to buy it as often since it is not really a treatment and does not require recurring purchases, thus affecting a steady revenue stream.",2,2,"I have past experiences in operations and marketing roles. I have past internships in Marketing and PR and i believe that i can value add in this department. I have also planned both online and physical camps as an operations exec , an example is The Adulting Challenge, where i was in charge of ops for a financial literacy boot camp which lasts for 3 days.","B: not sure if the mkt is even relevant to what we would need (since it seemed insurance themed?)
","B; mainly stating work experience, but I guess marketing is relevant to protege","Where do you see yourself in 5 years. As a VC, it is important to understand the goals and aims of the startup and the plans that they have in store to be successful. There is no point investing in a startup that does not have a scaling or continuity plan as they are doomed to fail.","B: good question, slightly vague explanation on why this question over others. ",B; okay but not very compelling,"Jeshua Koh, Kuljiv Singh, my dad. All 3 of them have clear goals in mind and would stop at nothing to achieve them.",3,3,"60%. I am quite confident as i have the willingness to do so, but the other 40% is where the ability comes in. I am the type of person who always likes to try new things and go out of my comfort zone and space travel is definitely something on my bucket list, but that’s if i am able to afford it.",4,4,,
40,Rahul Paleja,Darius Cheong,2,No,checked,NIL,"Yes, I do have past experience interning in startups. ",3,4,I believe that joining Protege Venture would help in my personal growth,2,1,"Polybee. This is a golden era for hydraulic farming especially in Singapore where Covid19 have shown why we have to be able to self sustained through our agriculture. Hence, I visualize more growth in this space than the other 4 startups. ",3,2,Neobank. The space is too saturated and I don't think its business model is very different from their competitors out there.,3,2,Outreach and operation,B: Not explained but outreach could be useful if they did it properly and well ,C; 0 explanation,The character of the founders of startup. I believe a startup will succeed with leader with good character and mentality. ,"C: not really a question, the founder-centric approach is fair, but not explained",C; sounds a bit oversimplistic to me,NIL ,0,0,Maybe in 20 years. I am confident we are going to spaces as this topic have been circulating for the past few years.,2,3,,would not recommend
41,Jarod Hong,Darius Teo,1,No,checked,N/A for now,"During NS, I moonlighted under the business consultancy Iron Lotus Advisory, conducting industry and market research for business advisory projects across SEA region aimed at improving cross-border scalability. Attachments include credit scheme for low-income individuals w/ 800k users and another credit scheme for small enterprises w/ SGD 1MM funding",4,3,"I believe that starting a disruptive tech company is the best way to have sustained, positive societal impact, and applying to this program is part of my experimentation process to figure out how exactly I'm going to do something so unrealistic.",3,2,"Polybee

Disclaimer: Evaluating businesses based on publicly available info is difficult and horrible ideas can turn out to be very economical when applied. Therefore, my criteria is the business model which I can identify as having the least assumptions that a VC might have to resolve.

1. Institutional support for the company and the industry. In the Singapore startup scene (due to a small domestic market), institutional support can be a major stepping stone to expansion. Having worked with the Agrifood and Veterinary Authority of Singapore and the Ministry of Sustainability and the Environment in policy-related discussions, I know that Singapore is aggressively investing in local food production for the next decade. Seeing as notable institutional partners such as the SFA and Temasek have shown support, this shows that Polybee is likely to have met very stringent standards and will likely at least receive some financial or regulatory backing to expand in a key policy focus.

2. Polybee's stated focus on collecting data shows me that the company is able to diagnose and quantify key areas of improvement, which is crucial for scaling a startup and overcoming barriers to growth. While the company may not know all the answers, its quantitative, data-driven shows that it knows what questions to ask. This is a determining factor for startup success in the long run. Therefore, with quantitative methodology and strong institutional backing, Polybee gives me relatively little concern at a glance.

Friz is operating in a very saturated market with very innovative and well-founded competitors (Brex, Square, Stripe), therefore it's hard for me to assume that they will out-execute all these competitors. Noah and Ease seem to serve a well-defined and potentially quite profitable niche. The only question I would have for them is how they would compete with other merchants from simply undercutting them. From publicly available data, I don't know enough about the market to understand whether their approach provides a significant competitive edge, and therefore I can't recommend them in confidence.",5,5,"Whizz Mobility

1. Tough market. The food delivery market is extremely competitive and saturated, with multiple large, relatively similar companies trying to undercut each other. Following Peter Thiel's advice of avoiding competition, this market is by far the hardest one to disrupt.

2. Potential gaps. While the idea of a delivery robot saves costs and is more efficient in theory, in practice this increases the number and complexity of problems which need to be solved vs the existing solution of a human operator. Deliverymen can adapt to difficult customers, take common sense shortcuts and fulfil small requests by conversing with the customer. A robot doing this would be much harder to automate, leading to backlogs on the scale of hundreds of orders. In addition, simply scaling the project beyond a university campus would require the ability to navigate roads, which in itself is a major industry issue.In other words, Whizz's business model poses far more questions than solutions in order to be viable.",5,4,"Online platform development: I was also previously Head of Ventures for SGExams, SG's largest online student forum w 300k monthly visitors, intiating projects w/ private businesses and the Ministry of Education and securing over 30k SGD in funding for a student-led education reform initiative. Also previously managed Owlcove.sg, an online notes-sharing platform w 27k subscribers, overseeing platform updates (using PHP and JavaScript) and schoolwide releases through social media. (Link to projects: https://www.reddit.com/r/SGExams/comments/d6d0lq/our_student_dialogues_an_sgexams_initiative/ , https://www.reddit.com/r/SGExams/comments/e0deoi/uni_us_uk_university_admissions_ama_with_crimson/ )

Social media marketing + lobbying: Co-founded Fridays4FutureSG, launching a Freedom of Speech petition w 5k signatures which was discussed in Parliament. During this, I learned Instagram, YouTube and Reddit analytics, mailing lists and other online marketing skills. Featured on Al Jazeera and BBC for activism work. (Link to petition: https://www.change.org/p/prime-minister-lee-hsien-loong-let-everyone-in-singapore-have-the-right-to-freedom-of-assembly/sign)

Trading/investing: Invested in GameStop at $35, sold at $290 average upon release of Short Interest data. Also scalped CLOV for a 2400% gain. Invested in Dogecoin at 13 cents, sold at 67 cents average before SNL. Other profitable investments (30%+ gains) include CRTO, NVAX, BDRY, ZIM, NMM, BB, WKHS, EH, NOK, MP, PLTR, Thorchain, TFUEL and FAANG. Losers include MWK and many rookie options/futures trades. Currently learning market technical analysis, crypto tokenomics, blockchain app development and automated quant trading to further my understanding of cryptocurrencies as an investment and potential future line of work.",A: Shows capability of carrying through his actions,A: Has venture blood,"Broad question: ""What does your company do?"" A lot of startups seem to struggle with succinctly answering this question, which should filter out the less prepared prospects.

Specific question: ""What is the cost of customer acquisition?"" For a startup to be scalable and ultimately successful, the revenue earned per customer should generally outweigh the cost. Startups that can comfortably fulfil this criteria are usually safer (and less expensive) bets than ones that operate at a loss in the hopes of eventually becoming sustainable. For later-stage startups, this is the key metric.",B: Both general questions,B: agree with Jarod,"Ong Ye Kung, who I cold-emailed with two proposals for student-led education reform projects after I drew a pencil portrait of him during his afternoon talk at RI. He rejected the first, but then I became Head of Ventures at SGExams and emailed him a more detailed proposal which got greenlit. My impression of him is a tactful, open-minded leader who takes his work and others' opinions seriously (he responded to my email at 12am asking for further details).

Jamie Beaton, Crimson Education founder who I am cold-emailing a second time soon to propose another partnership. He finished bachelors' and Masters' degrees at Harvard, Stanford and obtained the Rhodes Scholarship while founding a multimillion dollar company and reading a lot of books. From what I've deduced, he is a visionary who aims to change the global education landscape. If nothing else, his time management is very on-point.

Howey Ou, FridaysForFuture China founder. While not conventionally successful like the other two due to essentially being blacklisted by the CCP, I think it's important to recognise people who did the right thing at a personal cost.",5,5,"Short answer: Likely yes.

From my time looking into Virgin Galactic as an investment, the current pace of innovation in orbital travel supports constantly and exponentially lower costs, much like computers in the 1980s or electric vehicles in the 2000s. In addition, as I am from a privileged background (globally speaking) and such innovations have generally been accessible to such demographics. In a few decades, I would speculate that I am able to splurge a bit to go to space either for leisure, business or even rapid long-distance commuting. Personally, while I don't go on vacations, I've heard that astronauts who go to space gain a new perspective on life, so I might consider it.",4,5,"Will be an asset to the team. Shows great grit and hustle with all of his endeavours
","Risk taker, jump at every opportunity. Great."
42,Jarod Hong,Darius Teo,2,No,checked,Building of my own pre-startup.,"Yes.I am the founder of Ai.Novate. My team, Ai.Novate is a start-up that I am working on and from the name itself, it is going to be a company who aims to solve daily life problems with the help of Artificial Intelligence and Innovation. We aim to become one of Singapore's biggest technology start-up that could potentially penetrate the whole world and create a positive impact. One of our products is ""Digitalis-ed Puppet"" and in short ""Digi Pup"" which strive to maximise efficiency in learning for preschoolers during this pandemic and to also bring in features which could benefit our target market in the long run. It has also won the best innovation in Prudential Young Trailblazer.",5,5,"I would like to build brand and reputation as well as connect with expertise who relates to the product that I am currently doing. As Protege Ventures also provides bootcamp and lessons, I would like to gain the knowledge and skills for the benefit of my company in the future.",4,3,"Whizz Mobility. Technology is currently a leading sector in the industry such as Industry 4.0. Also, there is a current covid-19 pandemic and there needs to be a way to transport food and essentials while reducing human contact. Whizz Mobility have a high fidelity working prototype which is already at work and also featured on news which brings security to most investors as it shows that it is doable, innovative and impactful. Whizz Mobility is also sustainable in the long run as they can increase shape, size maximum weight that it can carry, delivering other goods or even services.",3,4,Friz. Stronger competitors are out there and opportunities for Friz are the least among the rest. It is not really a demand for freelancers to open another bank account as a freelancer myself. Benefits given by Friz are similar to their competitors and there is not really a unique selling proposition. There is also a 2% transaction fee which is not so appealing to us freelancers as we can just use normal DBS or POSB and etc cards where there are no transaction fees. ,3,2,"Project management, Outreach, Innovation, Marketing, Internet of Things (A module that I have taken), pre-startup. ",B: Could apply technical experiences learnt in school ,"B: No explanation of ""so what""","What is your unique selling proposition and have you gotten your target market's constructive feedbacks and what were their thoughts and opinion. Do you have a working prototype that have been tested by your target market? VCs would like to know if your product is doable and penetrable into the target market. Ensuring that the product meets the demands of the target audience and whether the company is really passionate about knowing their target market needs and demands. Also, having a working prototype is important for the VCs to understand and know how your product really works whether the target market response is positive about it or not.","B: Thought through extensively plenty of questions, but didnt narrow down to 1",B: good attempt,"Me, myself and I. Firstly, I am the one who have the choice whether I would like to do it or not. No one else could stop me or myself. Even if I were to have mentors, or people who are encouraging me or spurring me on, at the end of the day, I am the one who makes the decision for myself.",2,1,"1. Very confident. If I were to dream about me going to space, I would be in space. I can do it as and when I want and it would be counted as me going into space. Even in my dreams, there were already times where I dreamt of myself in space and to me it already felt as though I am there. ",3,2,"Above average, confident in her responses and her thought process. High potential to excel in PV if provided the opportunity",Not recommended - Can be seen rushing through this assignment
