Tag Number,Assesor A,Assesor B,"1h) As of August 2021, what year of study would you be in?",1i) Will you be graduating before Jun 2022?,"1j) Should you be accepted into Protege Ventures, would you be able to commit to sessions on a weekly basis for the next 12 months? Sessions will be suspended during exam season.","1k) What other commitments might you have for the next 12 months? (ie CCA Clubs, Freelance work, etc)",1l) Do you have any prior experience in the startup/VC space? Elaborate.,1l Assesor A's Score (1-5),1l Assessor B's Score (1-5),2a) Why do you want to join Protege Ventures?,2a Assesor A's Score (1-5),2a Assesor B's Score (1-5),"2b) From the above list, which startup are you most likely to recommend to Protégé Ventures, for us to invest in? Share your thought process and justify with minimally 2 reasons.",2b Assesor A's Score (1-5),2b Assessor B's Score (1-5),"2c) From the same list, which startup are you least likely to recommend to Protégé Ventures, for us to invest in? Share your thought process and justify with minimally 2 reasons.",2c Assesor A's Score (1-5),2c Assessor B's Score (1-5),2d) Share with us some skill(s) (preferably one that is relevant to Protégé Ventures) that you are confident in. Feel free to include a link to some of your previous works (if any).,2d Assesor A's Score (A-C) + comments,2d Assessor B's Score (A-C) + comments,2e) What do you think is the most important question VCs should ask? Why?,2e Assesor A's Score (A-C) + comments,2e Assessor B's Score (A-C) + comments,2f) Who are 3 individuals in your network that you identify as unstoppable forces of nature? Why?,2f Assesor A's Score (1-5),2f Assessor B's Score (1-5),2g) What is the probability of you travelling into space sometime in your life? How confident are you of your answer and why? ,2g Assesor A's Score (1-5),2g Assessor B's Score (1-5),Assessor A Overall Comments,Assessor B Overall Comments
1,Nich,Marcus Wan,3,No,checked,None for now,No,"0
",0,"I have heard many good things from my friends who were previous batches of analyst. They told me about the great learning experiences they had and the hands on approach Protege Ventures adopt which enabled them to grow as a person. Personally, i am someone who is tech-savy and interested in the field of Venture Capital. I believe that VCs are noble in a way that they are at the forefront of instigating ground breaking changes for the world. This is done so by providing adequate fundings for startups in order to carry on their operations or research in order to bring their products/service to life. ",3,3,"Personally, i would recommend Polybee, a deep tech startup. As the world shifts towards going green and sustainability. I feel that a business model like Polybee will be increasingly relevant in the world. Through combining technology with farming, they are able to improve on the traditional methods of age old farming methods which used to be done manually and grow more from less.

Additionally, Polybee has successfully programmed its autonomous drones to pollinate strawberries, tomatoes and other indoor food crops with a more than 90 per cent success rate of bearing fruit.

Furthermore, Polybee provides a solution to a need. Natural pollinators are either unavailable in most geographies, or are too difficult to manage in indoor environments.Thus, Polybee's service is able to change this and improves productivity in controlled-environment agriculture.",2,2,"I would be least likely to recommend Whizz Mobility. They are competing in an industry of delivery services which is already very saturated with stronghold competitors. Additionally, the scalability of the product will be low in my opinion given the size and the capacity of the robot. Although the company can build a bigger robot, it would sacrifice safety and would pose a problem on the roads. ",2,2,"Outreach, Programs, Operations, Excel, Management, Marketing",B - Vague answers without much detail regarding what types of skills,"B - No details
","What pain point does their business solve? In order for a product/service to be viable in the long run, it has to be able to solve a problem for people, be it small or big. As long as there is a need, there would be a market for the VCs. Therefore, I feel it is crucial to ask themselves if what they are trying to put in the market is something that people want and need. ","B+ - To be honest, it is a good enough answer but they could have ceased the opportunity to develop the answer",A - Answer is reasonable with adequate elaboration,"I believe that my father, friend (Andrew) and other friend (Julius) to be unstoppable forces of nature. I believe that these three individuals carry the same trait of being determined, persistent and hardworking. As a firm believer that hard work always pays off and the lack of talent could be made up by putting in extra hours, these people have shown me and affirmed my beliefs. Take my father for example, he started off at the bottom with no inheritance or wealth. He had to work part time while studying for his degree and eventually he made it and became rather successful. My two friends Andrew and Julius, they were not blessed with the best grades in school. Julius in particular was kicked out of secondary school. However, eventually the both of them through sheer hard work are doing well in local universities and managed to secure good internships. ","3
",3,"I believe given the speed of advancements Elon Musk and SpaceX is having, I would be able to travel to space in another 40-50 years time. I feel that having confidence is akin to having half the battle won. As VC investors, we should dream of the endless possibilities and be optimistic. People did not believe we are able to fly but yet we have done it. Thus, i am confident sometime in my life, this will become a reality. ",3,3,Answered the questions but could have developed their answers more,"Generally gave decent answers, but did not particularly stand out."
2,Nich,Marcus Wan,1,No,checked,"Want to join Investment and Entrepeneurs society at YNC. Also have my own little website development business, however those are all manageable.","Yes, when I was younger I played through different startup scenarios and developed different startup concepts including an automatic  kitchen robot that could cook customised meals.","1
",1,"I am very much interested in the startup and investment culture as I want to dive into the energy sector after college and build up a big international green energy company. Every experience, skill and influence I can get beforehand is very valuable to me.",1,2,"Probably polybee as it tackles a problem that is definitely going to get worse and also provides a solution to when bees went extinct. I think as of right now this startup would probably be most useful in Singapore or other cities with very high population density, however why I think it is interesting for investors is because two factors determine the demand for this concept: 1) availability of bees 2) how difficult it is to supply citizens with enough food. According to current trends and predictions we will have a major problem with the extinction of many insects and due to climate change it will be more and more difficult to provide the growing population with an adequate amount of food using conventional methods. I don’t yet know the economics but the concept is very promising.",1,2,"Usefriz because I don’t know how prevalent this problem is in society and also I have no clue about banking. I can only say I never had problems with my financials and invoices with my website business so I don’t understand it fully, don‘t know if it‘s needed, not passionate about it and don’t know the financials so I am least likely to recommend this one.",1,1,"My biggest and most valuable skill is creative problem solving and that applies to any area of business or life. Having lived on three continents, studied maths and physics at university level in addition to high school and founded my first business at 19, has taught me to be very effective in using my time and to be flexible and creative in approaching problems from different angles. I strongly believe I will find a solution to every problem and developed some skills like marketing, selling, designing, website management and leadership qualities along the way to help me transform my ideas into reality.","B - General skill sets
","B - Only skill that kind of stands out is website management and maybe marketing. Apart from that, it is basically fluff.","„What is the longterm vision that you have for this company?“ because that determines every step leading up to the vision. Also it is very important if the people involved have been responsible for outstanding results in the past, however I consider the final goal or vision a company wants to accomplish the most important.",B - Abit of a deviation from my personal answer and I believe the question might be too specific for it to be something you must know,"B - Answer is ok, but elaboration does not justify it well. ","One of my grandmothers because she came from nothing and built multiple immensely successful businesses in Germany although she was confronted with major societal disadvantages as a woman.
My father also came from nothing and is now the general manager of a big tech company in China.
And myself, although I haven’t gotten immensely successful yet, I never gave up ever, I know exactly what I want to achieve in life and I will do everything humanly possible reach that goal.",3,3,"I don’t want to die on earth and I think it is very likely that I will travel into space during my lifetime. I think the spaceflight industry has made huge advances recently so, although you can never know for sure, I strongly believe that within my lifespan it will be possible to travel to space.",2,3,Vague answers and generally an underwhelming attempt,Gave a mixture of poor to average answers. Way of thinking seems to sometimes be self-centric and not very objective.
3,Nich,Marcus Wan,2,No,checked,None. ,No.,"0
",0,"To broaden my perspective and gain an insight in the ventures industry. Moreover, to understand how to manage a start up firm. ",1,1,"Whizz mobility. In view of the covid-19 situation, there will be less people willing to go out to go out and get food/groceries so as to minimise interaction and so on. Whizz mobility could reduce interaction and make delivery easier.This will lead to an increase in demand in the current situation.  On the other side, since it is an automatic robot, there is not much management fees related to it other than maintenance fee and so on. ",1,1,"Noah. According to statistics in the Singapore context, there is not much issues regarding on men's health. Moreover, there is high cost associated with the Noah startup such as paying the doctors, maintenance fee etc and so forth. ",1,2,"Marketing, designing skills. Proficient in photoshop and Microsoft Office. Asset management skills.",B - Marketing and Design Skills which will be valuable for Partnerships & MarCom,"B - Marketing skills may be relevant
",Is it worth investing and sustainable ? Start up that might be worth investing could go down hill with the world changing. ,C - Not really the most analytical answer,"C - Poor answer, with weak explaination",None. ,0,0,"80%. As technology advances, I believe that everything is possible.(Unless I couldn't make it till that day)",1,2,Little effort,"Short, generic answers with no/poor elaborations. Does not provide us with sufficient information to understand their way of thinking
"
4,Nich,Marcus Wan,2,No,checked,NIL,Have ran a failed start-up. My team and I were attempting to build a mobile application for home based businesses to increase their outreach. We had pitched at a few competitions and gathered some funding.,4,4,Protégé Ventures would equip me with the necessary skill to nature a start up and most importantly learn the necessary skills involved. Hence Protege would be the most appropriate place for me to grow.,3,4,"Polybee would be the best option to invest into firstly because of the strong demand for consumptions. The population growth is rampant and hence the demand for food and this project will therefore gain alot of traction.
Secondly, this project has the potential to disruption the traditional farming methodology due to the integration of technology pushing yield up. This ensures an efficient use of resources and hence cuts cost and potentially be cost competitive.",2,2,"Whizz mobility.
The last mile delivery has been the most inefficient portion of the ecommerce space. This project integrates it with technology hence reducing the cost significantly. This could distrupt the industry.

Secondly,this project could be expanded to other services beyond food which gives it tremendous profitability. ",2,1,"Research, Financial modelling, Coding ",B - Coding skills are desirable but a lot of our members can do the rest too,"B - Depending on coding skillset/specialization and proficiency, may be relevant in special projects team.","What problem does this address?
Every business has a potential to grow given that it addresses a societal issue. I firmly believe that it has to contribute to society and value add in order to be seen as a business with potential to grow.","B+ - To be honest, it is a good enough answer but they could have ceased the opportunity to develop the answer","A - Answer is reasonable with adequate elaboration
","My CCA president. He was someone whom completely changed my perception of norms and taught me how to take different views of things.

My father who has always resembled the values of hardwork determination and perseverance. Seeing him go through such difficult times crafted alot of my character today.

Lastly, my football coach who taught me the importance of humility ",3,3,I belive it will happen within my lifetime. Especially with projects such as spaceX. ,"1
",2,Started strong with experiences but in general a lackluster effort in answering our questions,"Decent background in the start-up ecosystem, but answers were either average or poor."
5,Nich,Marcus Wan,3,No,checked,"Vice President - Bridges for Enterprise
Part-Time Internship - Provident Capital Partners","Investment Intern - Saison Capital (Dec 2020 - Apr 2021)
Job Scope:
- Deal sourcing through outreach and events to develop start-up pipeline of the firm
- Deal analysis by conducting industry analysis, market sizing, competitor analysis, etc",5,5,"""- Interested to develop my skill sets in the VC space and be exposed to more interesting start-ups that I can analyze and learn from for my future career aspirations
'- Interested to meet new friends that share similar passion in finance and entrepreneurship in Protege Ventures as well as learning and growing alongside them
- Interested to have access to professionals within Protege Ventures network to connect with them and learn from them more about the VC and start-up space in Singapore""",5,5,"Friz - Neobank for freelancers and digital entrepreneurs
- There is a rising trend and increasing popularity for youngsters to engage in freelance work, with this, there comes an increasing need for banking solutions for these people, therefore, I believe that Friz is able to achieve product-market fit given the current situation
- A neobank has a clear roadmap for monetization and consequently profitability, invoice payment and credit lines are clear ways that Friz can make money from their business model, moreover, there is high flexibility to add on other features including insurances, etc
- Solid ecosystem with partnership with Mastercard and Funding Societies, Friz can tap on these networks to grow their business and scale up their user base at a much faster rate",4,3,"Whizz Mobility - Delivery service for business
- There is a rising trend for autonomous vehicles and delivery systems around the world, however, considering that this business model is R&D heavy and requires intensive technological development, the scalability of this business model is in question
- I can't see a clear roadmap for monetization, simply charging users with a commission fee might be one clear way, but I don't think that there is a huge margin in this monetization strategy, moreover, there is no incentive for why people should choose Whizz vs Grab
- The technology might not be applicable outside a safe area like NTU, it might be difficult to roll out the technology in the CBD area or malls as underlying infrastructure must be put in place (such as stations, routes, etc), hence, the scalability outside campus is questionable",4,4,"'- I am confident in writing investment memos (https://drive.google.com/file/d/1lsXozgqIgCV2I8TPMMdxP6GMMo6Lwds7/view?usp=sharing)
- I have exposure to Java and Python as programming languages
- I have several leadership experiences in running events and organizing programs",A - Great skillsets can immediately value add as a Special Projects Member,A - Clearly experienced in working in a VC. Good head start. ,"I think this question is not yet complete as it depends on the person the VC is asking to
- To Associates/Analysts/Interns : Tell me how you analyze a start-up --> Shows the thought process of the person being interviewed for the position
- To Start-ups : Tell me your growth and monetization strategy --> Shows the vision of the founders in developing their start-ups to be worth hundreds of millions of dollars
VCs might also ask other questions to other parties in the ecosystem, really depends",A - Great justification for each component,A - Good answers. Elaboration shows clear understanding of some of the things we should look out for in a start-up.,"Chia Jeng Yang (Principal, Saison Capital) : I met Chia in my previous internship, he's a very bright, critical and well-educated guy with a constant aura of skepticism when analyzing start-ups. His wide range of connection, deep domain expertise in start-ups and passion for entrepreneurship makes him a very interesting guy and firm leader.
Christian Chonardo (Student, NUS) : I met Christian in one of my classes, he's a very bright and outgoing guy with 2 start-up side projects he's currently working on while pursuing a Full Time studies in NUS business school and being active in various student communities. His time management skills, inherent curiosity and raw intelligence makes him an incredibly competitive guy when it comes to professional work and someone I don't wanna mess with.
Jovita Suryawinata (Student, NUS) : I met Jovita in one of my classes, she's a very dilligent and ambitious guy with a passion for marketing and consulting. She doesn't back down when told that she can't do things and can always find ingenious ways to solve problems.",5,5,"The probability of me travelling into space sometime in my life is very low. I am very confident of this answer, not because I'm too skeptical about space travel nor that I am acting pessimistic. It's simply because I'm scared of heights. But with that aside, I believe that there is a low to moderate probability of space travel being accessible in the next 20-30 years. The technology is there but it requires much more time to make it affordable by the general public thanks to the economies of scale and competition among space companies.",4,4,Great effort and a strong application from start to end. Could have more from the space question but a great applicant.,Strong VC background and it shows in the quality of answers given. Overall a promising candidate.
6,Benedict Chong,Mak Wei Zheng,5,Yes,checked,Ad-hoc part-time work,Worked in a seed stage and another growth stage VC. Also NOC alumni.,4,5,Network and make friends with other like-minded individuals to bounce ideas and exchange investments leads and opportunities in the future,3,4,"Ease Healthcare: Display initial user traction (28,000+ min of telehealth service by 12,000+ users), No red flags with social media engagement - looks organic and healthy. Angel investor, Bambos Kaisharis, (Director at Google with 20 years of experience in marketing, sales, BD in IT sector) brings smart money and network to the table. Market trend wise, telemedicine likely to see early adopters in sensitive health issues. May take a while before widespread adoption of getting polyclinics and GPs to be on board - but once it happens, there will be huge investor appetite to invest in telemedicine platforms that have demonstrated previous expertise and commercial traction and this is where Ease Healthcare is well positioned to be. The hype phase of telemedicine happened about 2-3 years ago, and currently I think that the telemedicine start-ups are now figuring what works and what doesn't, and COVID has been a huge catalyst in warming up consumers to the idea of remote consultation. ",3,5,"Friz: Honestly I think it has the highest potential among the list given the founder experience and previous funding from reputable VCs including YC, 500 durian, with sound revenue model and plans to ride on the fintech wave into SEA market. However, given that it just raised undisclosed 6 digits, the next round likely to be beyond protege's deal size of pre-seed to seed of around <$50,000 (correct me if I am wrong). So due to misalignment in investment scope, I find it hard to recommend this opportunity to Protege VC.",3,5,"Slide deck making, market research. Happy to get on a call to showcase some of the decks I prepared for past early-growth stage investment thesis interview assignments","B - Claims to and I assume he has some competencies based on his work experiences, as well as his analysis in 2b and 2c. But it is hard to determine without seeing for ourselves.",A - I think this applicant's slide making and market research skills tie in well to the research and education function within PV. ,"What is the commercial traction and how are the unit economics. Having commercial traction validates that there is indeed market need and people are willing to pay for what you are offering to the market. Follow-up question on unit economics e.g., LTV:CAC to evaluate the quality of the growth/commercial traction. Burning venture-backed money to grow customer base is not necessarily a deal breaker, but the founder must be prepared to show how the business model can achieve profitability at the unit level upon reaching critical mass and provide evidence that they are making progress towards that goal. ","B: Think it misses the mark but there is some completeness of thought here where his experiences shine through
",A - The question posed is sensible and the applicant elaborated on its significance. Expanding on his/her question and posing following questions was also a nice touch as it shows the thought that went into his/her question of choice.,"My NOC Israel Manager, Sharon. I think in general, majority of the Israeli I've met during my overseas stint come off pretty strong relative to S'poreans. So, it is no surprise that my NOC Israel manager who has worked as the manager in charge of the NOC Israel program for over a decade have adopted some of their ways. Somehow, miraculously she could expedite the embassy visa application process from 2 months to be same-day approval in order to make it for the flight the following day using her connections and what not. Nothing seem to be impossible for her. Other individuals are my Israeli colleagues and entrepreneurs I've met there - they never seem to take no as an answer which I seldom see locally.  ",3,4,"Unlikely. I don't foresee space travel being commoditized within our generation. I think people often underestimate the costs and development time required for projects (see: planning fallacy). I guess the key point here is that I am not saying that commercial space flight is impossible within our generation, I am saying that prices will not fall to the point where common folks (me) will be able to afford them. I suppose it's like asking people on the streets on how likely they think they will fly in a private jet in their lives, and most would say unlikely even though the technology is fully commercialized.",3,5,"Candidate has experience obviously that could serve us well in analysis, although it has to be tuned towards earlier-stage investments. Weighed against his time to graduation, do not think that his current analytical competence and required perspective shift would be a sufficient value add to either parties.","Overall, this applicant provided great insights and well-thought out answers. It is obvious that he/she put effort into answering every question seriously. Additionally, the applicant shows great interest and has the skills and qualifications that would make them a good analyst."
